{
  "id": "combat_ready",
  "version": "1.0.0",
  "state": "combat",
  "duration": 2.0,
  "loop": true,
  "globalIntensity": 1.2,
  "globalSpeed": 1.5,
  "blendInDuration": 0.3,
  "blendOutDuration": 0.3,
  "parameters": {
    "ParamBreath": {
      "enabled": true,
      "amplitude": 0.4,
      "speed": 1.2,
      "phase": 0,
      "easing": "sine",
      "waveform": "sine",
      "baseValue": 0.0,
      "minClamp": -0.6,
      "maxClamp": 0.6
    },
    "ParamBodyAngleX": {
      "enabled": true,
      "amplitude": 0.08,
      "speed": 0.6,
      "phase": 0,
      "easing": "ease_in_out",
      "waveform": "sine",
      "baseValue": 0.05,
      "minClamp": -0.3,
      "maxClamp": 0.3
    },
    "ParamBodyAngleY": {
      "enabled": true,
      "amplitude": 0.05,
      "speed": 0.5,
      "phase": 1.57,
      "easing": "sine",
      "waveform": "sine",
      "baseValue": 0.1,
      "minClamp": -0.2,
      "maxClamp": 0.3
    },
    "ParamBodyAngleZ": {
      "enabled": true,
      "amplitude": 0.03,
      "speed": 0.4,
      "phase": 3.14,
      "easing": "sine",
      "waveform": "sine",
      "baseValue": 0.0,
      "minClamp": -0.15,
      "maxClamp": 0.15
    },
    "ParamEyeOpenL": {
      "enabled": true,
      "amplitude": 0.05,
      "speed": 0.3,
      "phase": 0,
      "easing": "linear",
      "waveform": "sine",
      "baseValue": 1.0,
      "minClamp": 0.8,
      "maxClamp": 1.0
    },
    "ParamEyeOpenR": {
      "enabled": true,
      "amplitude": 0.05,
      "speed": 0.3,
      "phase": 0,
      "easing": "linear",
      "waveform": "sine",
      "baseValue": 1.0,
      "minClamp": 0.8,
      "maxClamp": 1.0
    },
    "ParamBrowLY": {
      "enabled": true,
      "amplitude": 0.15,
      "speed": 0.2,
      "phase": 0,
      "easing": "ease_out",
      "waveform": "sine",
      "baseValue": 0.2,
      "minClamp": 0.0,
      "maxClamp": 0.5
    },
    "ParamBrowRY": {
      "enabled": true,
      "amplitude": 0.15,
      "speed": 0.2,
      "phase": 0,
      "easing": "ease_out",
      "waveform": "sine",
      "baseValue": 0.2,
      "minClamp": 0.0,
      "maxClamp": 0.5
    },
    "ParamArmLA": {
      "enabled": true,
      "amplitude": 0.1,
      "speed": 0.8,
      "phase": 0,
      "easing": "ease_in_out",
      "waveform": "sine",
      "baseValue": 0.3,
      "minClamp": 0.0,
      "maxClamp": 0.6
    },
    "ParamArmRA": {
      "enabled": true,
      "amplitude": 0.1,
      "speed": 0.8,
      "phase": 3.14,
      "easing": "ease_in_out",
      "waveform": "sine",
      "baseValue": 0.3,
      "minClamp": 0.0,
      "maxClamp": 0.6
    },
    "ParamHairFront": {
      "enabled": true,
      "amplitude": 0.12,
      "speed": 0.7,
      "phase": 0.3,
      "easing": "sine",
      "waveform": "sine",
      "baseValue": 0.0,
      "minClamp": -0.4,
      "maxClamp": 0.4
    }
  },
  "ratingClamps": {
    "ParamChestSoftX": { "min": -0.3, "max": 0.3 },
    "ParamChestSoftY": { "min": -0.3, "max": 0.3 },
    "ParamAbdomenSoft": { "min": -0.2, "max": 0.2 },
    "ParamPelvisShift": { "min": -0.15, "max": 0.15 }
  },
  "metadata": {
    "author": "DivineHeros Team",
    "created": "2025-01-01T00:00:00Z",
    "description": "Combat ready stance with heightened alertness",
    "tags": ["combat", "ready", "alert"]
  }
}